{
  "version": 1,
  "geometrySchemaVersion": 3,
  "status": "accepted-staging",
  "activeOfficePromotion": false,
  "auditSource": "assets/game/manifests/office-asset-geometry-audit.json",
  "sourcePolicy": "Original reviewed pixels are immutable; cleanup keeps a reviewed component envelope and composites reuse exact source pixels as staging layers.",
  "counts": {
    "total": 77,
    "byWave": {
      "step-13": 24,
      "step-14": 40,
      "step-15": 6,
      "step-16": 7
    },
    "cleanup": 64,
    "composites": 13,
    "verifiedNoopCleanup": 16
  },
  "records": [
    {
      "recordId": "library:env-03-research-creative:camera.tripod",
      "assetId": "camera.tripod",
      "wave": "step-13",
      "operation": "clean-largest-component-bounds",
      "status": "accepted-staging",
      "source": {
        "file": "assets/game/processed/office-library-modern-bright-v1/env-03-research-creative/camera.tripod.png",
        "sha256": "cc47f997e3d62d7d238f1cd354c82e666d7a8221c37de2a9177800d29e56d4ee",
        "width": 286,
        "height": 273,
        "alphaPixels": 21471,
        "licenseState": "project-generated"
      },
      "recipe": {
        "keepBox": [
          8,
          8,
          160,
          265
        ],
        "foregroundRegions": []
      },
      "metrics": {
        "retainedAlphaPixels": 20228,
        "removedAlphaPixels": 1243
      },
      "outputs": [
        {
          "role": "clean",
          "file": "assets/game/processed/office-derived-v1/step-13/env-03-research-creative/camera.tripod.clean.png",
          "sha256": "d3092a054bf4520de282e4b96fd8122a720d8dbba433de1aafe213c35ae9bdbe",
          "width": 286,
          "height": 273,
          "alphaPixels": 20228
        }
      ],
      "geometry": null
    },
    {
      "recordId": "library:env-03-research-creative:scale.digital",
      "assetId": "scale.digital",
      "wave": "step-13",
      "operation": "clean-largest-component-bounds",
      "status": "accepted-staging",
      "source": {
        "file": "assets/game/processed/office-library-modern-bright-v1/env-03-research-creative/scale.digital.png",
        "sha256": "b0bf61c15c60efa92ed94a6560ecd97a1457fcd3d4c4bd851da32b9b7ec9028a",
        "width": 311,
        "height": 191,
        "alphaPixels": 32812,
        "licenseState": "project-generated"
      },
      "recipe": {
        "keepBox": [
          8,
          21,
          217,
          183
        ],
        "foregroundRegions": []
      },
      "metrics": {
        "retainedAlphaPixels": 30743,
        "removedAlphaPixels": 2069
      },
      "outputs": [
        {
          "role": "clean",
          "file": "assets/game/processed/office-derived-v1/step-13/env-03-research-creative/scale.digital.clean.png",
          "sha256": "2bdc1b90e2d9606b69112d137e08c3651ba2d18c1f6f8208340b732432023aa0",
          "width": 311,
          "height": 191,
          "alphaPixels": 30743
        }
      ],
      "geometry": null
    },
    {
      "recordId": "library:env-03-research-creative:turntable.display",
      "assetId": "turntable.display",
      "wave": "step-13",
      "operation": "clean-largest-component-bounds",
      "status": "accepted-staging",
      "source": {
        "file": "assets/game/processed/office-library-modern-bright-v1/env-03-research-creative/turntable.display.png",
        "sha256": "32023bb173db4843774ea3b07e6448dd680aa30c3412ec581163fa769ea402be",
        "width": 324,
        "height": 174,
        "alphaPixels": 27399,
        "licenseState": "project-generated"
      },
      "recipe": {
        "keepBox": [
          8,
          8,
          222,
          153
        ],
        "foregroundRegions": []
      },
      "metrics": {
        "retainedAlphaPixels": 27179,
        "removedAlphaPixels": 220
      },
      "outputs": [
        {
          "role": "clean",
          "file": "assets/game/processed/office-derived-v1/step-13/env-03-research-creative/turntable.display.clean.png",
          "sha256": "5bb20b3e9dea7feef3aefa64ba6bbd1b4d362fb533abbb120452b893ac18d3c0",
          "width": 324,
          "height": 174,
          "alphaPixels": 27179
        }
      ],
      "geometry": null
    },
    {
      "recordId": "library:env-04-release-noc:alert.beacon",
      "assetId": "alert.beacon",
      "wave": "step-13",
      "operation": "clean-largest-component-bounds",
      "status": "accepted-staging",
      "source": {
        "file": "assets/game/processed/office-library-modern-bright-v1/env-04-release-noc/alert.beacon.png",
        "sha256": "1f1748ad81e882a42251790e3b2322037b0be0fbf9b57fb08c284d167034a66a",
        "width": 272,
        "height": 248,
        "alphaPixels": 34335,
        "licenseState": "project-generated"
      },
      "recipe": {
        "keepBox": [
          8,
          8,
          193,
          240
        ],
        "foregroundRegions": []
      },
      "metrics": {
        "retainedAlphaPixels": 33466,
        "removedAlphaPixels": 869
      },
      "outputs": [
        {
          "role": "clean",
          "file": "assets/game/processed/office-derived-v1/step-13/env-04-release-noc/alert.beacon.clean.png",
          "sha256": "89f472d063b50cd72de8f27102591ede2390ba3911c8f5d7f94b06e07fc0830b",
          "width": 272,
          "height": 248,
          "alphaPixels": 33466
        }
      ],
      "geometry": null
    },
    {
      "recordId": "library:env-04-release-noc:cable.management.tray",
      "assetId": "cable.management.tray",
      "wave": "step-13",
      "operation": "clean-largest-component-bounds",
      "status": "accepted-staging",
      "source": {
        "file": "assets/game/processed/office-library-modern-bright-v1/env-04-release-noc/cable.management.tray.png",
        "sha256": "e47b52c37366176cf2253c2419ff7b1c57fa86fb85dba49c0243931599e31cbd",
        "width": 329,
        "height": 199,
        "alphaPixels": 44829,
        "licenseState": "project-generated"
      },
      "recipe": {
        "keepBox": [
          8,
          8,
          265,
          191
        ],
        "foregroundRegions": []
      },
      "metrics": {
        "retainedAlphaPixels": 43599,
        "removedAlphaPixels": 1230
      },
      "outputs": [
        {
          "role": "clean",
          "file": "assets/game/processed/office-derived-v1/step-13/env-04-release-noc/cable.management.tray.clean.png",
          "sha256": "92e384942bd318127a47712c3e99c7751eb486bba7238274e98f990c5e6aa2f3",
          "width": 329,
          "height": 199,
          "alphaPixels": 43599
        }
      ],
      "geometry": null
    },
    {
      "recordId": "library:env-04-release-noc:network.router.firewall",
      "assetId": "network.router.firewall",
      "wave": "step-13",
      "operation": "clean-largest-component-bounds",
      "status": "accepted-staging",
      "source": {
        "file": "assets/game/processed/office-library-modern-bright-v1/env-04-release-noc/network.router.firewall.png",
        "sha256": "7beca51ceb0cb3e12ad2c1534b41ebfc821320b5fdc4c373b187cd9b74a5ad00",
        "width": 317,
        "height": 240,
        "alphaPixels": 37614,
        "licenseState": "project-generated"
      },
      "recipe": {
        "keepBox": [
          8,
          8,
          261,
          230
        ],
        "foregroundRegions": []
      },
      "metrics": {
        "retainedAlphaPixels": 35777,
        "removedAlphaPixels": 1837
      },
      "outputs": [
        {
          "role": "clean",
          "file": "assets/game/processed/office-derived-v1/step-13/env-04-release-noc/network.router.firewall.clean.png",
          "sha256": "67ee78c6dd36a13d8bde1dc740798fb589c412dccf99424085e0d64294b947fb",
          "width": 317,
          "height": 240,
          "alphaPixels": 35777
        }
      ],
      "geometry": null
    },
    {
      "recordId": "library:env-09-phase2-completion-architecture:emergency.light.wall",
      "assetId": "emergency.light.wall",
      "wave": "step-13",
      "operation": "clean-largest-component-bounds",
      "status": "accepted-staging",
      "source": {
        "file": "assets/game/processed/office-library-modern-bright-v1/env-09-phase2-completion-architecture/emergency.light.wall.png",
        "sha256": "688e2995bb55d3f894c65beed4a99422ae24a65918ef000ee1b31d454248bdcf",
        "width": 256,
        "height": 127,
        "alphaPixels": 10705,
        "licenseState": "project-generated"
      },
      "recipe": {
        "keepBox": [
          8,
          8,
          99,
          107
        ],
        "foregroundRegions": []
      },
      "metrics": {
        "retainedAlphaPixels": 8918,
        "removedAlphaPixels": 1787
      },
      "outputs": [
        {
          "role": "clean",
          "file": "assets/game/processed/office-derived-v1/step-13/env-09-phase2-completion-architecture/emergency.light.wall.clean.png",
          "sha256": "d629a57c7e64c65908b0b54ea6c8f9941436a180ba981c06fd9cd794e4538407",
          "width": 256,
          "height": 127,
          "alphaPixels": 8918
        }
      ],
      "geometry": null
    },
    {
      "recordId": "library:env-09-phase2-completion-architecture:light.wall.decorative",
      "assetId": "light.wall.decorative",
      "wave": "step-13",
      "operation": "clean-largest-component-bounds",
      "status": "accepted-staging",
      "source": {
        "file": "assets/game/processed/office-library-modern-bright-v1/env-09-phase2-completion-architecture/light.wall.decorative.png",
        "sha256": "6a593f2591f77f97ec49d1c507e26f584eff4ec2c8b956c04ed491267af3af32",
        "width": 232,
        "height": 205,
        "alphaPixels": 9641,
        "licenseState": "project-generated"
      },
      "recipe": {
        "keepBox": [
          8,
          8,
          50,
          175
        ],
        "foregroundRegions": []
      },
      "metrics": {
        "retainedAlphaPixels": 6832,
        "removedAlphaPixels": 2809
      },